<?xml version="1.0" encoding="UTF-8"?>
<!DOCTYPE circuito SYSTEM "circuito.dtd">
<circuito>
    <nombre>MotorLand Aragón</nombre>

    <datosFisicos>
        <longitudCircuito>5078</longitudCircuito>
        <anchura>15</anchura>
    </datosFisicos>

    <evento>
        <fecha>2025-09-28</fecha>
        <hora>14:00</hora>
        <vueltas>23</vueltas>
        <patrocinador>Gran Premio Tissot de Aragón</patrocinador>
    </evento>

    <localizacion>
        <localidad>Alcañiz</localidad>
        <pais>España</pais>
        <origen>
            <longitud>-0.2136</longitud>
            <latitud>41.0792</latitud>
            <altitud>380</altitud>
        </origen>
    </localizacion>

    <tramos>
        <tramo>
            <distancia unidad="metros">1047</distancia>
            <coordenadas>
                <longitud>-0.2195</longitud>
                <latitud>41.0772</latitud>
                <altitud>375</altitud>
            </coordenadas>
            <sector>1</sector>
        </tramo>
        <tramo>
            <distancia unidad="metros">2031</distancia>
            <coordenadas>
                <longitud>-0.2130</longitud>
                <latitud>41.0850</latitud>
                <altitud>385</altitud>
            </coordenadas>
            <sector>2</sector>
        </tramo>
        <tramo>
            <distancia unidad="metros">2000</distancia>
            <coordenadas>
                <longitud>-0.2136</longitud>
                <latitud>41.0792</latitud>
                <altitud>380</altitud>
            </coordenadas>
            <sector>3</sector>
        </tramo>
    </tramos>

    <resultado>
        <vencedor>
            <nombrePiloto>Francesco Bagnaia</nombrePiloto>
        </vencedor>
        <tiempo>41m 35.456s</tiempo>
    </resultado>

    <clasificacionMundial>
        <piloto>
            <posicion>1</posicion>
            <nombre>Francesco Bagnaia</nombre>
            <puntos>250</puntos>
        </piloto>
        <piloto>
            <posicion>2</posicion>
            <nombre>Marc Márquez</nombre>
            <puntos>235</puntos>
        </piloto>
        <piloto>
            <posicion>3</posicion>
            <nombre>Jorge Martín</nombre>
            <puntos>228</puntos>
        </piloto>
    </clasificacionMundial>

    <referencias>
        <ref href="https://www.motorlandaragon.com/">Página oficial de MotorLand Aragón</ref>
        <ref href="https://es.wikipedia.org/wiki/MotorLand_Arag%C3%B3n">Wikipedia: MotorLand Aragón</ref>
        <ref href="https://www.motogp.com/es/gp-results/2024/ara">Resultados oficiales de MotoGP</ref>
    </referencias>

    <galeriaFotos>
        <foto fichero="media/aragon_pano.jpg" titulo="Vista panorámica del circuito">aragon_pano.jpg</foto>
        <foto fichero="media/aragon_recta.jpg" titulo="Recta de meta de MotorLand">aragon_recta.jpg</foto>
    </galeriaFotos>

    <galeriaVideos>
        <video fichero="media/aragon_resumen.mp4" titulo="Resumen de la carrera">aragon_resumen.mp4</video>
    </galeriaVideos>

</circuito>